{"kind":"ui_reference_style_pack_v1","metadata":{"id":"concept-art","name":"概念图风格","version":"1.0.0"},"negative_rules":["禁止重排、增删或遮挡原型控件。","禁止新增标题、品牌、文案、水印或营销内容。","禁止摄影写实、3D 渲染、PBR 或电影海报效果。","禁止跨面板改变已确认的项目配色、线条、控件和字体层级。","禁止自动引入日漫、欧美卡通、像素、厚涂或水彩流派。"],"origin":{"id":"system-neutral-2d-game-v1","sha256":"7b06a37f2335b03494b4a0ce6e1626a1a6611665e73e583df64fb94a5384ce53","version":"1.1.0"},"palette":{"background":"#E8ECF1","primary":"#4476B4","secondary":"#8B9CAF","surface":"#FAFBFD","text":"#1D2C40"},"render_style":{"color":"中等饱和度，清晰明度层级；项目 palette 固定实际颜色，不默认霓虹或电影调色。","lighting":"柔和、中性、稳定的照明。","line":"清晰轻描边或弱描边；避免强烈漫画墨线。","material":"金属、木材、塑料等基础材质可辨，不过度写实。","render_finish":"适合游戏面板的清晰完整 2D 资产。","shape_language":"稳定、易识别的框体与控件轮廓，细节适中。","texture":"适量细节，无高频噪点、重笔触和胶片颗粒。","visual_identity":"中性、干净、易读、不强调特定流派的 2D 游戏 UI。"},"ui_rules":{"background":"完整不透明画布；背景对比低于控件，不增加场景、角色或遮挡信息的光效。","controls":"主按钮、次按钮、页签、滑条和开关使用同一项目轮廓与色阶；保留原型数量、几何、选中、启用和数值状态。","decoration":"少量边界内装饰，不强调特定流派。","frame":"简洁面板框与轻边框；固定转角和边框厚度。","icons":"清晰简化图标，统一线宽和填色。","typography":"保留原型准确中文、数字和标点；标题、正文、数值层级固定；使用清晰字形，不增加文案。字形艺术效果不得降低可读性。"}}
