{"kind":"ui_reference_style_pack_v1","metadata":{"id":"fantasy-handpainted","name":"幻想手绘","version":"1.0.0"},"negative_rules":["禁止重排、增删或遮挡原型控件。","禁止新增标题、品牌、文案、水印或营销内容。","禁止摄影写实、3D 渲染、PBR 或电影海报效果。","禁止跨面板改变已确认的项目配色、线条、控件和字体层级。","禁止纹理、笔触或装饰掩盖文字与控件边缘。"],"origin":{"id":"fantasy-handpainted-v1","sha256":"a5f8939ebc565c4210ceac213397cc4c0be64c84f193e3be7b2a49e07a03a643","version":"2.0.0"},"palette":{"background":"#242F3D","primary":"#B68842","secondary":"#668E87","surface":"#E3D7BB","text":"#302A26"},"render_style":{"color":"中等饱和、冷暖关系丰富；主交互可有局部高饱和焦点。","lighting":"柔和定向光，适度体积感与环境光。","line":"弱描边或局部描边，以明暗和边缘控制表现框体。","material":"木材、皮革、金属、布料以手绘方式区分，不过度写实。","render_finish":"高品质奇幻 RPG 面板插画完成度。","shape_language":"框体、控件边缘有适度奇幻层次，服从原型几何。","texture":"轻微笔触和材质纹理，无高频噪点。","visual_identity":"结构清晰、有绘画感和材质层次的奇幻游戏 UI。"},"ui_rules":{"background":"完整不透明画布；背景对比低于控件，不增加场景、角色或遮挡信息的光效。","controls":"主按钮、次按钮、页签、滑条和开关使用同一项目轮廓与色阶；保留原型数量、几何、选中、启用和数值状态。","decoration":"边框内少量奇幻纹样，正文区保持干净。","frame":"有轻笔触的木金框体，固定边框材质和角部装饰密度。","icons":"清楚的手绘图标，统一边缘、笔触和光照方向。","typography":"保留原型准确中文、数字和标点；标题、正文、数值层级固定；使用清晰字形，不增加文案。字形艺术效果不得降低可读性。"}}
