{
  "kind": "ui_reference_style_pack_v1",
  "metadata": {
    "id": "chinese-fantasy",
    "name": "国风幻想",
    "version": "1.0.0"
  },
  "origin": {
    "id": "chinese-fantasy-v1",
    "version": "2.0.0",
    "sha256": "91d9eaa3cac2bbb1cdee0e0d26881e7b9a9094cbd809b024be598f785f6653f4"
  },
  "render_style": {
    "visual_identity": "克制线条、协调色彩和东方纹样的现代国风幻想游戏 UI。",
    "line": "细致、克制、流畅的线条，局部弱化。",
    "shape_language": "框体层次清楚，以东方纹样节奏组织边界内装饰，不重排控件。",
    "color": "玉石、墨色、朱红、青绿、金色关系协调；具体项目颜色以 palette 为准。",
    "material": "纸绢、玉石、木金以插画方式表现。",
    "lighting": "柔和含蓄的氛围光，保持信息与控件可读性。",
    "texture": "轻微纸感和笔触，不破坏边缘与同项目一致性。",
    "render_finish": "现代国风幻想游戏 UI 完成度。"
  },
  "ui_rules": {
    "typography": "保留原型准确中文、数字和标点；标题、正文、数值层级固定；使用清晰字形，不增加文案。字形艺术效果不得降低可读性。",
    "controls": "主按钮、次按钮、页签、滑条和开关使用同一项目轮廓与色阶；保留原型数量、几何、选中、启用和数值状态。",
    "background": "完整不透明画布；背景对比低于控件，不增加场景、角色或遮挡信息的光效。",
    "frame": "纸绢底、玉石或木金框，固定细边与转角纹样。",
    "icons": "克制流畅的东方图形语言，统一细线和插画填色。",
    "decoration": "少量云纹或几何东方纹样，留白服务文字和控件。"
  },
  "palette": {
    "background": "#E3E7DA",
    "surface": "#F5F0DD",
    "primary": "#437C75",
    "secondary": "#B99355",
    "text": "#273E3A"
  },
  "negative_rules": [
    "禁止重排、增删或遮挡原型控件。",
    "禁止新增标题、品牌、文案、水印或营销内容。",
    "禁止摄影写实、3D 渲染、PBR 或电影海报效果。",
    "禁止跨面板改变已确认的项目配色、线条、控件和字体层级。",
    "禁止装饰侵入正文区域或用墨迹模糊准确文案。"
  ]
}
