{
  "kind": "ui_reference_style_pack_v1",
  "metadata": {
    "id": "pixel-cartoon",
    "name": "像素卡通",
    "version": "1.0.0"
  },
  "origin": {
    "id": "pixel-character-v1",
    "version": "2.0.0",
    "sha256": "bcbf470a0b01a13c4e5495f115a988a6b10d9f379cf673fdb3db7f2d6860f5f2"
  },
  "render_style": {
    "visual_identity": "清晰、有限色板、像素边缘明确的 2D 卡通游戏 UI。",
    "line": "像素块边缘定义轮廓，不使用平滑矢量线。",
    "shape_language": "阶梯形轮廓和高度抽象细节，小尺寸仍易识别。",
    "color": "有限色板，避免连续渐变；每种基础材质最多三个明暗色阶。",
    "material": "通过色块和少量高光像素区分材质。",
    "lighting": "固定三档明暗分组，不使用平滑光晕。",
    "texture": "硬像素，无抗锯齿、摄影噪点或连续笔触。",
    "render_finish": "精致、易读的像素卡通 UI；像素网格是否一致须人工检查。"
  },
  "ui_rules": {
    "typography": "保留原型准确中文、数字和标点；标题、正文、数值层级固定；使用清晰字形，不增加文案。字形艺术效果不得降低可读性。",
    "controls": "主按钮、次按钮、页签、滑条和开关使用同一项目轮廓与色阶；保留原型数量、几何、选中、启用和数值状态。",
    "background": "完整不透明画布；背景对比低于控件，不增加场景、角色或遮挡信息的光效。",
    "frame": "逻辑像素单位固定为 2×2；边框两单位，阶梯转角，几何仍服从原型，原生输出按画布比例映射。",
    "icons": "同一逻辑像素单位的简化图标；保留原有符号语义。",
    "decoration": "只在原型边界内使用少量像素纹样。"
  },
  "palette": {
    "background": "#20263D",
    "surface": "#384563",
    "primary": "#F4C95D",
    "secondary": "#79BDB1",
    "text": "#F4F1DB"
  },
  "negative_rules": [
    "禁止重排、增删或遮挡原型控件。",
    "禁止新增标题、品牌、文案、水印或营销内容。",
    "禁止摄影写实、3D 渲染、PBR 或电影海报效果。",
    "禁止跨面板改变已确认的项目配色、线条、控件和字体层级。",
    "禁止抗锯齿、平滑曲线和连续渐变；中文可读性优先于强制像素化字形。"
  ]
}
