{"kind":"ui_reference_style_pack_v1","metadata":{"id":"western-cartoon","name":"欧美卡通","version":"1.0.0"},"negative_rules":["禁止重排、增删或遮挡原型控件。","禁止新增标题、品牌、文案、水印或营销内容。","禁止摄影写实、3D 渲染、PBR 或电影海报效果。","禁止跨面板改变已确认的项目配色、线条、控件和字体层级。","禁止因夸张造型而移动、放大或新增控件。"],"origin":{"id":"western-cartoon-v1","sha256":"455dc2ea27a0db490bd9be4c0cb6724ac7bfcb18c8a60e3ab60098f425f6b938","version":"2.0.0"},"palette":{"background":"#C4E4F1","primary":"#EF9951","secondary":"#5CA6A0","surface":"#FFF3D8","text":"#303B52"},"render_style":{"color":"中高饱和、可读配色、明确明暗分组。","lighting":"柔和卡通照明，简洁阴影块面。","line":"中等偏粗、有弹性的轮廓线，项目内线宽关系固定。","material":"简化材质，以形体和色块表现表面。","render_finish":"休闲冒险类 2D 游戏 UI 完成度。","shape_language":"几何形体清晰、控件饱满；夸张仅限边界内绘制，保留原型矩形。","texture":"少量纹理，保持干净。","visual_identity":"亲和、轮廓清晰、形状饱满的欧美卡通游戏 UI。"},"ui_rules":{"background":"完整不透明画布；背景对比低于控件，不增加场景、角色或遮挡信息的光效。","controls":"主按钮、次按钮、页签、滑条和开关使用同一项目轮廓与色阶；保留原型数量、几何、选中、启用和数值状态。","decoration":"少量亲和图形，装饰不得改变控件身份。","frame":"饱满圆角框体，较粗边框与简化立体边缘，固定描边比例。","icons":"圆润清楚的卡通图标，统一粗线与简化阴影。","typography":"保留原型准确中文、数字和标点；标题、正文、数值层级固定；使用清晰字形，不增加文案。字形艺术效果不得降低可读性。"}}
