{
  "kind": "ui_reference_style_pack_v1",
  "metadata": {
    "id": "anime-cel",
    "name": "日系赛璐璐",
    "version": "1.0.0"
  },
  "origin": {
    "id": "anime-cel-v1",
    "version": "2.0.0",
    "sha256": "6f099fba043a6268b27e57701ef4fb89d2824ffa58beb341054597d8f2dc6bba"
  },
  "render_style": {
    "visual_identity": "干净线稿和简洁赛璐璐阴影的日系 2D 游戏 UI。",
    "line": "细到中等粗细的清晰线，局部线宽变化，无厚重墨线。",
    "shape_language": "清楚、有层次的框体和控件轮廓，不改变原型几何。",
    "color": "中高饱和、清晰色块；渐变和局部高光克制。",
    "material": "简化色块与高光区分材质，无高频真实纹理。",
    "lighting": "稳定主光加一至两层硬边赛璐璐阴影。",
    "texture": "低纹理噪点，表面干净。",
    "render_finish": "商业日系游戏 UI 的清晰完成度。"
  },
  "ui_rules": {
    "typography": "保留原型准确中文、数字和标点；标题、正文、数值层级固定；使用清晰字形，不增加文案。字形艺术效果不得降低可读性。",
    "controls": "主按钮、次按钮、页签、滑条和开关使用同一项目轮廓与色阶；保留原型数量、几何、选中、启用和数值状态。",
    "background": "完整不透明画布；背景对比低于控件，不增加场景、角色或遮挡信息的光效。",
    "frame": "细线边框，固定倒角与硬边阴影层级。",
    "icons": "干净细线与清晰色块，统一高光方向。",
    "decoration": "克制的日系图形点缀，不添加角色或徽标。"
  },
  "palette": {
    "background": "#E9EEF9",
    "surface": "#FFFFFF",
    "primary": "#657FDE",
    "secondary": "#E9A9C4",
    "text": "#23365A"
  },
  "negative_rules": [
    "禁止重排、增删或遮挡原型控件。",
    "禁止新增标题、品牌、文案、水印或营销内容。",
    "禁止摄影写实、3D 渲染、PBR 或电影海报效果。",
    "禁止跨面板改变已确认的项目配色、线条、控件和字体层级。",
    "禁止复杂电影光照和厚重漫画墨线。"
  ]
}
